### ISSUE TITLE
HttpClient always add 'content-length:0' to GET request

### ISSUE THREAD

**Issue by hygehyge** [dart-lang/sdk#43574]
- Dart 2.9.2(stable)
- Windows 10 x64

When I create an HTTP GET request as below, HttpClient always adds `content-length:0`. 
I check my request by Fiddler.
The server I want to request returns `Status Code:400 Bad Request` if request's header contains content-length.
How can I remove this header ?

```Dart
    final client = HttpClient();
    final request = await client.openUrl(
        'GET', Uri.parse('https://www.example.com/api'));

    //No options makes a request as
    //user-agent: Dart/2.9 (dart:io)
    //accept-encoding: gzip
    //content-length: 0  <-- THIS IS THE PROBLEM !!
    //host: www.example.com

    //This makes a request as
    //user-agent: Dart/2.9 (dart:io)
    //accept-encoding: gzip
    //content-length: 0  <-- THIS IS THE PROBLEM !!
    //host: www.example.com
    request.headers.contentLength=-1;

    //This makes a request as
    //user-agent: Dart/2.9 (dart:io)
    //accept-encoding: gzip
    //content-length: 0  <-- THIS IS THE PROBLEM !!
    //host: www.example.com
    request.headers.contentLength = -1;
    request.headers.add('content-length', -1);

    //What options can I add to remove content-length from header ?

    final response = await request.close();
```

**Comment by hygehyge** [comment]
Is there any workaround for this?
I can't continue to develop my app by this problem.

**Comment by hygehyge** [comment]
After some additional try, I've found strange behavior.
When I use `HttpHeaders`'s `set` method and "watch" the `request` variable in debug mode as below, `content-length` header is removed.
Without "watch", the header still remains.
I cannot understand what happened... Any ideas?

```Dart
    final client = HttpClient();
    final request = await client.openUrl(
        'GET', Uri.parse('https://www.example.com/api'));

    request.headers.set('content-length', '-1');

    final response = await request.close();  //break here and watch request in debug mode, request's header doesn't contain content-length.

    print(response.statusCode); //print 200 if I watch. print 400 if I don't watch...
```

**Comment by slightfoot** [comment]
I just got caught out by this. I wanted to use `WebSocket` class with Cloud Run. And because it starts with a `GET` request to upgrade the connection to a web-socket it fails because the server closes the connection because of the `content-length` header being specified.

I recreated the `WebSocket.connect` method, adding `request.headers.removeAll(HttpHeaders.contentLengthHeader);` before the `await request.close()`. and it connected and worked fine. 

I tracked the issue down to this line here:
https://github.com/dart-lang/sdk/blob/d63d5d93a59b370bf5f5c277109110cb67a96b75/sdk/lib/_http/http_impl.dart#L1156

@mit-mit The [HTTP/1.1 RFC-7231](https://tools.ietf.org/html/rfc7231#page-25) on Page 25, states the following:
> A payload within a GET request message has no defined semantics; sending a payload body on a GET request might cause some existing implementations to reject the request.

I think this should be resolved as lots more people are going to start working with Dart on the server-side and expect HTTP to function as per-the standard.

@mit-mit I could post a fix to WebSocket but it would seem more appropriate to fix the underlying HTTP implementation. What are your thoughts?

**Comment by kevmoo** [comment]
CC @natebosch – one more thing!

FYI @jonasfj

**Comment by brianschardt** [comment]
I am running into this exact issue. lol, Im thinking of creating my own websocket library that does not sest content-length. I am also in contact with the GCP cloud run team on this.

**Comment by aam** [comment]
@slightfoot are you still seeing that removing content-length fixes WebSocket communication with Cloud Run service?

There is https://github.com/dart-lang/sdk/issues/45139 about the same problem too.

**Comment by slightfoot** [comment]
> @slightfoot are you still seeing that removing content-length fixes WebSocket communication with Cloud Run service?
> 
Yes. Removing the header resolves it with regards to cloud run.

**Comment by aam** [comment]
Thanks for quick reply @slightfoot .
I was curious to see whether it fixes the problem of communicating with sample service as described https://github.com/dart-lang/sdk/issues/45139#issuecomment-794173112 but it doesn't seem to make a difference for me neither at latest dart sdk nor at d63d5d9 you mentioned in your comment above. Sample quarkus java webservice running on Cloud Run seems to just close connection on first data sent by the dart webservice client.

**Comment by aam** [comment]
ah, I might have hit a different issue with `ws://` versus `wss://`:
`dart run wsclient.dart --url ws://websocket-echo-server-quarkus-xxxxxxxxxx-xx.x.run.app/websocket` doesn't work even after `content-length` header was removed(fails with same symptoms as when `content-length` was present), but `dart run wsclient.dart --url wss://websocket-echo-server-quarkus-xxxxxxxxxx-xx.x.run.app/websocket` does indeed work without `content-length` header.

**Comment by thomas-ferchau** [comment]
@aam, thank you very much for looking into this.
@brianschardt @slightfoot, thank you for pointing to the `content-length` header.

I suggest a modification to `websocket_impl.dart` if changing `http_impl.dart` is too wide-ranging. The proposed change can be seen here:
https://github.com/dart-lang/sdk/issues/45139#issuecomment-828344653

With this change, HTTPS/WSS works for me:
````
dart run wsclient.dart --url wss://websocket-echo-server-quarkus-xxxxxxxxxx-xx.x.run.app/websocket
dart run wsclient.dart --url wss://websocket-echo-server-python-xxxxxxxxxx-xx.x.run.app/
````

But HTTP/WS does not work even with the `content-length` header removed:
````
dart run wsclient.dart --url ws://websocket-echo-server-quarkus-xxxxxxxxxx-xx.x.run.app/websocket
dart run wsclient.dart --url ws://websocket-echo-server-python-xxxxxxxxxx-xx.x.run.app/
````

There is an interesting log output from the Python echo server:
````
asyncio.exceptions.IncompleteReadError: 0 bytes read on a total of 2 expected bytes
````

You can easily start my little Python WebSocket echo server on Google Cloud Run here to try that:
https://github.com/buehren/websocket-echo-server-python#server-cloudrun


**As the problem starts in `websockets/framing.py`, maybe there is something wrong with the frame header?**
This seems to be a separate problem. Could it have something to do with the redirect from HTTP to HTTPS?
You can see the exact line here:
https://github.com/aaugustin/websockets/blob/8.1/src/websockets/framing.py#L105


This is the complete log output:
````
2021-04-28 12:36:09.115 CEST GET 302 0 B 0 ms Dart/2.12 (dart:io) http://websocket-echo-server-python-xxxxxxxxxx-xx.x.run.app/
2021-04-28 12:36:11.600 CEST GET 101 483 B 2.2 s Dart/2.12 (dart:io) https://websocket-echo-server-python-xxxxxxxxxx-xx.x.run.app/
2021-04-28 12:36:11.601 CEST Error in connection handler
2021-04-28 12:36:11.601 CEST Traceback (most recent call last): File "/usr/local/lib/python3.8/site-packages/websockets/protocol.py", line 827, in transfer_data message = await self.read_message() File "/usr/local/lib/python3.8/site-packages/websockets/protocol.py", line 895, in read_message frame = await self.read_data_frame(max_size=self.max_size) File "/usr/local/lib/python3.8/site-packages/websockets/protocol.py", line 971, in read_data_frame frame = await self.read_frame(max_size) File "/usr/local/lib/python3.8/site-packages/websockets/protocol.py", line 1047, in read_frame frame = await Frame.read( File "/usr/local/lib/python3.8/site-packages/websockets/framing.py", line 105, in read data = await reader(2) File "/usr/local/lib/python3.8/asyncio/streams.py", line 721, in readexactly raise exceptions.IncompleteReadError(incomplete, n) asyncio.exceptions.IncompleteReadError: 0 bytes read on a total of 2 expected bytes
2021-04-28 12:36:11.601 CEST
2021-04-28 12:36:11.601 CEST The above exception was the direct cause of the following exception:
2021-04-28 12:36:11.601 CEST
2021-04-28 12:36:11.601 CEST Traceback (most recent call last): File "/usr/local/lib/python3.8/site-packages/websockets/server.py", line 191, in handler await self.ws_handler(self, path) File "wsecho.py", line 8, in echo async for message in websocket: File "/usr/local/lib/python3.8/site-packages/websockets/protocol.py", line 439, in __aiter__ yield await self.recv() File "/usr/local/lib/python3.8/site-packages/websockets/protocol.py", line 509, in recv await self.ensure_open() File "/usr/local/lib/python3.8/site-packages/websockets/protocol.py", line 803, in ensure_open raise self.connection_closed_exc() websockets.exceptions.ConnectionClosedError: code = 1006 (connection closed abnormally [internal]), no reason
````

It was produced for this run:
````
> dart run wsclient.dart --url ws://websocket-echo-server-python-xxxxxxxxxx-xx.x.run.app/
2021-04-28 10:36:08.927888 Starting connection attempt to ws://websocket-echo-server-python-xxxxxxxxxx-xx.x.run.app/ ...
2021-04-28 10:36:09.483541 WebSocket readyState: 1
2021-04-28 10:36:11.517937 Sending 'hello'
2021-04-28 10:36:11.679346 CONNECTION DONE!
readyState=3
closeCode=1005
closeReason=

2021-04-28 10:36:13.486038 Sending 'how are you?'
2021-04-28 10:36:15.485670 Sending 'still there?'
````


Maybe a tcpdump would help to investigate the problem (created from another run):
````
> sudo tcpdump -vv -i any port 80

tcpdump: listening on any, link-type LINUX_SLL (Linux cooked), capture size 262144 bytes
10:59:55.292569 IP (tos 0x0, ttl 64, id 48126, offset 0, flags [DF], proto TCP (6), length 60)
    10.0.2.15.57920 > 216.239.36.53.http: Flags [S], cksum 0x0962 (incorrect -> 0xd9ac), seq 4123479103, win 64240, options [mss 1460,sackOK,TS val 3505091755 ecr 0,nop,wscale 7], length 0
10:59:55.325695 IP (tos 0x0, ttl 64, id 54339, offset 0, flags [none], proto TCP (6), length 44)
    216.239.36.53.http > 10.0.2.15.57920: Flags [S.], cksum 0x411e (correct), seq 1193992705, ack 4123479104, win 65535, options [mss 1460], length 0
10:59:55.325729 IP (tos 0x0, ttl 64, id 48127, offset 0, flags [DF], proto TCP (6), length 40)
    10.0.2.15.57920 > 216.239.36.53.http: Flags [.], cksum 0x094e (incorrect -> 0x5dea), seq 1, ack 1, win 64240, length 0
10:59:55.363573 IP (tos 0x0, ttl 64, id 48128, offset 0, flags [DF], proto TCP (6), length 382)
    10.0.2.15.57920 > 216.239.36.53.http: Flags [P.], cksum 0x0aa4 (incorrect -> 0x6a45), seq 1:343, ack 1, win 64240, length 342: HTTP, length: 342
        GET / HTTP/1.1
        user-agent: Dart/2.12 (dart:io)
        connection: Upgrade
        cache-control: no-cache
        accept-encoding: gzip
        sec-websocket-version: 13
        host: websocket-echo-server-python-xxxxxxxxxx-xx.x.run.app
        sec-websocket-extensions: permessage-deflate; client_max_window_bits
        sec-websocket-key: 67fEJW101wAwI7lzopzgLQ==
        upgrade: websocket

10:59:55.363712 IP (tos 0x0, ttl 64, id 54340, offset 0, flags [none], proto TCP (6), length 40)
    216.239.36.53.http > 10.0.2.15.57920: Flags [.], cksum 0x5785 (correct), seq 1, ack 343, win 65535, length 0
10:59:55.639752 IP (tos 0x0, ttl 64, id 54341, offset 0, flags [none], proto TCP (6), length 368)
    216.239.36.53.http > 10.0.2.15.57920: Flags [P.], cksum 0xec55 (correct), seq 1:329, ack 343, win 65535, length 328: HTTP, length: 328
        HTTP/1.1 302 Found
        location: https://websocket-echo-server-python-xxxxxxxxxx-xx.x.run.app/
        x-cloud-trace-context: 474229585e7cad4832ea12b1422165bb
        date: Wed, 28 Apr 2021 10:59:55 GMT
        server: Google Frontend
        x-envoy-upstream-service-time: 134
        Content-Length: 0
        Content-Type: text/html; charset=UTF-8
        Connection: close

10:59:55.639780 IP (tos 0x0, ttl 64, id 48129, offset 0, flags [DF], proto TCP (6), length 40)
    10.0.2.15.57920 > 216.239.36.53.http: Flags [.], cksum 0x094e (incorrect -> 0x5c94), seq 343, ack 329, win 63912, length 0

````

**Comment by slightfoot** [comment]
Looks like this might now be fixed. 
https://github.com/dart-lang/sdk/commit/6c254fab89adbeebfb616cdec497260db4cb7cf7

I don't currently have the opportunity to retest to confirm this fix works for `WebSocket.connect`.

**Comment by craiglabenz** [comment]
I just tested this with a connection from `WebSocketChannel.connect` to a Pipedream request viewer, and the `content-length` header had been correctly removed from the initial GET request.

**Comment by kevmoo** [comment]
@brianquinlan – can we close this?
